0,FED,FEDERATION,United Federation of Planets,SOL,Peaceful,Compassion,Ethical,Idealistic,federation,FEDERATION,TRUE,TRUE,FEDERATION,"The United Federation of Planets is a coalition of worlds bound by a mutual desire for peace, the pursuit of scientific understanding, and trade. By far however, the most numerous of the Federation races is one of the founding members, the Humans of Sol. The people of the Federation live in a society based on the values of liberty and equality. Their strength lies in extremely effective research, which grants them fast access to new technologies. Their high-quality products come at the expense of high resource costs, however. Because of their moral convictions, they quickly show weaknesses in the field of espionage and sabotage by Starfleet intelligence. However when under attack, some citizens of the Federation were known to effectively change their attitude to ""the ends justify the means"". With a fleet of well-rounded starships, the Federation is equally likely to be seen conducting trade, exploration, humanitarian, and diplomatic missions, as they are to be seen conducting military patrols and combat maneuvers. Starfleet is capable of ending battles, but do not want to start them. OUR CONTINUING MISSION: TO EXPLORE STRANGE NEW WORLDS, TO SEEK OUT NEW LIFE AND NEW CIVILIZATIONS, TO BOLDLY GO WHERE NO ONE HAS GONE BEFORE!"
1,ROM,ROMULAN,Romulan Star Empire,ROMULUS,Aggressive,Xenophobia,Ruthless,Materialistic,romulans,ROMULANS,TRUE,TRUE,,ROMULANS,"To outsiders, the Romulans are an enigmatic race. To the Romulans, however, other races have hardly any mystery left, for their talented intelligence agency, the Tal Shiar, has solved each of those mysteries. Romulan interests are protected by a veil of secrecy and covertness, just as their ships are hidden from prying eyes by powerful cloaking technologies. Their ships move undetected in groups until they are close to their unsuspecting victim, before decloaking and destroying their target in the ambush. Reports on Romulan society show it functions on exceptional research achievements. The basic supply of energy and food for the populace is sufficient to meet day-to-day needs, and is rigorously regulated to be resource-saving, as are their fleet maintenance costs; Romulan fleets expect to decimate the enemy before they have any chance at mounting a defense. In the 24th century, the Romulans became famous for their powerful and cost/performance efficient D'deridex class warbirds, which can however be build only slowly, so you shouldn't start a long, or even a multi-border war. Better use the deceptiveness of the Tal Shiar. WHEN KNOWLEDGE IS POWER, BEING UNKNOWN MEANS TO BE UNCONQUERABLE." 
2,KLING,KLINGON,Klingon Empire,KRONOS,Warlike,Indifferent,Honorable,Transactional,klingon,KLINGON,TRUE,TRUE,x,KLINGONS,"The Klingons are some of the most feared warriors in the galaxy. Their quest for glory and honor in battle makes them masters in the field of combat; be it in ground or space-based combat, their weapons arm quickly and strike hard. Some of their warships possess cloaking devices, with which the Klingons strike from the shadows at their prey. Their vigorous industrial forges process countless masses of raw materials, keeping their resource-hungry war machine running, whilst gigantic hunting parties guarantee the population's food supply. However, all things that do not directly serve battle are of lower importance to them and thus are less effective. The Klingons consider espionage a cowardly and dishonorable act, but are willing to defend themselves through internal security as necessary. Since Klingon engineers and scientists are not that qualified, you better conquer other words in order not to fall behind, in comparison to other empires. Minor empires, especially other warmongers respect the Klingon Empire. WHEN FOLLOWING THE WAY OF THE WARRIOR, EVERYDAY IS A GOOD DAY TO DIE!",
3,CARD,CARDASSIAN,Cardassian Union,CARDASSIA,Aggressive,Intolerant,Ruthless,Greedy,cardassian,CARDASSIAN,TRUE,TRUE,x,CARDASSIANS,"The Cardassians use any means necessary to ensure the absolute loyalty of their subjects. A national indoctrination, mixed with effective control methods, promotes an unconditional belief in the Cardassian systems and work ethics, which results in exceptional industrial and mining capacity. These state-promoted plants clearly work far more effectively than their food and energy installations however, and their research advances at a slow rate. Their intelligence services, the Obsidian Order, is their biggest strength, it is known as to be the best of the galaxy. Not even a Cardassian Gul, can order a soup without the Order knowing it. And sometimes people die, after doing the wrong thing... sabotaging other empires military installations, is also a specialty of the Obsidian Order. Cardassian ships continue the principle of community-controlled actions in space. Individually not very efficient, they are developed to attack in tight formations. The individual does not count, only the state does. FOR CARDASSIA!",
4,DOM,DOMINION,Dominion,OMARIAN_NEBULA,Aggressive,Xenophobia,Callous,Transactional,dominion,DOMINION,TRUE,TRUE,,DOMINION,"In the gamma quadrant the Changelings where hunted by non-changelings a.k.a the solids. In their bitterness, the Changelings, founded the Dominion. Now known as The Founders, they breed genetically engineered beings like the Vorta and the Jem´hadar. The latter became an army that subjugated every other race in the gamma quadrant one by one. In the end the entire galaxy will be ruled by the Dominion so that no Changeling needs to fear again. Powerful polaran beam weapons were made to fire though shields, creating heavy damage. However it was shown this worked only with minor races, as all major empires, found quick ways to adapt, technologically. The Dominion, however, has other means for galactic dominion as well. The Changeling shape-shift to any form, which makes them very good in espionage. If working, the Dominion also uses the diplomatic skill of cunning Vorta to create valuable alliances and persuade minors to join them, without a fight. The Jem´hadar, dependent on Ketracel-While, are among the best ground troops an empire can have and are sent if diplomacy fails. After 2000 years of Dominion rule without challengers, there are no species especially skilled in technological advancement, which is the biggest flaw of this empire. Both Vorta and Jem´hadar where designed to view the Founders as near-mythical gods. They know: VICTORY IS LIFE!",
5,BORG,BORG,Borg Collective,UNICOMPLEX,Warlike,Indifferent,Callous,Greedy,borg,BORG,TRUE,TRUE,,BORG,""We are the Borg. You will be assimilated. The Borg are/were a pseudo-species of cybernetic beings, or cyborgs, from the Delta Quadrant. No single individual truly existed within the Borg Collective (with the sole exception of the Borg Queen), as all Borg were linked into a hive mind. Their ultimate goal was the attainment of 'perfection' through the forcible assimilation of diverse sentient species, technologies, and knowledge. In addition to this stronghold in the Delta Quadrant, the Borg also dispatched vessels throughout the galaxy via transwarp conduits. When the Borg encounters other species and new technologies, they will assimilate both the crew and the ship as well, adding their distinctiveness to their own. Individual drones have demonstrated puzzlement at other species' unwillingness to be assimilated, the drones believing in the superiority of their way of life. In fact the Borg are twice as powerful as any other empire, since their cubes are gigantic and almost unbeatable, so: RESISTANCE IS FUTILE!"
6,TERRAN,TERRAN,TERRAN EMPIRE,TERRA,Warlike,Xenophobia,Ruthless,Greedy,terrans,TERRANEMPIRE,TRUE,TRUE,,TERRANEMPIRE,"There are many quantum realities. In one, called the mirror universe, there is an evil ""Federation"", the Terran Empire. Many times the Traveler influenced this universe, something happened that merged this universe with ours. The Terran Empire now competes with the Federation and other Empires in this milky way. The Terran Empire is driven by conquest and will destroy or enslave you if you do not bend to their will. While having almost identical ships as the Federation, they have a higher firepower. Science however is no longer as much of a priority or strength as it is to the Federation. Since the TE is not diplomatic smaller races do not trust the TE, but they fear it. Their defensive Intelligence is not very good, as they are always traitors. The expansion of the Terran Empire is always done by conquest and subjugation, however sometimes the Empire prefers allies, if they are more powerful than themselves. LONG LIVE THE EMPIRE!" 
7,ACAMARIANS,ACAMARIANS,ACAMARIANS,ACAMA,Aggressive,Intolerant,Ruthless,Transactional,acamarians,ACAMARIANS,TRUE,FALSE,,ACAMARIANS,The Acamarians wish to preserve their social structure. Will we take steps to ensure that they can?,
8,AKAALI,AKAALI,AKAALI,AKAALI,Peaceful,Indifferent,Regulated,Egalitarian,akaali,AKAALI,FALSE,FALSE,,AKAALI,"The Akaali are a primitive culture still finding their way, but they are skilled in managing the few resources they have. Any interaction in current planetary affairs would be inadvisable though, for it would hinder rather than benefit their development.",
9,AKRITIRIANS,AKRITIRIANS,AKRITIRIANS,AKRITIRI,Aggressive,Intolerant,Ruthless,Materialistic,akritirians,AKRITIRIANS,TRUE,FALSE,,AKRITIRIANS,"The Akritirian people are governed by an oppressive and often brutal regime that values obedience above all else, and they are unforgiving if common order is compromised. Their government should be approached with caution.",
10,ALDEANS,ALDEANS,ALDEANS,ALDEA,Peaceful,Intolerant,Honorable,Idealistic,aldeans,ALDEANS,FALSE,FALSE,,ALDEANS,"The Aldeans are a sophisticated culture, but value their isolationism. If we are to maintain diplomatic relations with them, we must be patient, but the eventual benefits will be immense.",
11,ALGOLIANS,ALGOLIANS,ALGOLIANS,ALGOL,Peaceful,Sympathetic,Ethical,Egalitarian,algolians,ALGOLIANS,FALSE,FALSE,,ALGOLIANS,The Algolians pride themselves on their distinctive gift for intellectual capacity and diversity. They would be an asset to our cultural exchange group.,
12,ALSAURIANS,ALSAURIANS,ALSAURIANS,ALSAURI,Peaceful,Intolerant,Ethical,Egalitarian,alsaurians,ALSAURIANS,TRUE,FALSE,,ALSAURIANS,The Alsaurians have for long suffered under the oppression of the neighboring Mokra Order. It would thus be prudent to remain neutral in diplomatic matters until lasting peace is achieved.,
13,ANDORIANS,ANDORIANS,ANDORIANS,ANDORIA,Warlike,Sympathetic,Honorable,Transactional,andorians,ANDORIANS,TRUE,FALSE,,ANDORIANS,"The Andorians are a deeply passionate people with a bloody past, but they desire a more Peaceful future.",
14,ANGOSIANS,ANGOSIANS,ANGOSIANS,ANGOSIA,Aggressive,Sympathetic,Regulated,Egalitarian,angosians,ANGOSIANS,FALSE,FALSE,,ANGOSIANS,"The Angosians have a nearly perfect society, but they pay a high price. Their enhanced soldiers deserve social, as well as military, respect.",
15,ANKARI,ANKARI,ANKARI,ANKARI,Pacifist,Compassion,Regulated,Egalitarian,ankari,ANKARI,TRUE,FALSE,,ANKARI,"The Ankari have a number of convoluted ritualistic beliefs, but they are a reasonably advanced culture, particularly in propulsion studies.",
16,ANTEDEANS,ANTEDEANS,ANTEDEANS,ANTEDEA,Neutral,Xenophobia,Callous,Greedy,antedeans,ANTEDEANS,FALSE,FALSE,,ANTEDEANS,"The Antedeans have advanced technology, particularly in aquatic science, but they find travelling in space alien to their nature.",
17,ANTICANS,ANTICANS,ANTICANS,ANTICA,Aggressive,Intolerant,Callous,Transactional,anticans,ANTICANS,FALSE,FALSE,,ANTICANS,"The Anticans are not as advanced as they would have us believe. An important first step would be a resolution of their conflict with the neighboring species, the Selay.",
18,ARBAZAN,ARBAZAN,ARBAZAN,ARBAZ,Peaceful,Intolerant,Regulated,Transactional,arbazan,ARBAZAN,TRUE,FALSE,,ARBAZAN,"The Arbazan are a highly conservative, yet sophisticated culture. Due to their temperate moralistic ways, they are seen to be arrogant, thus making diplomatic overtures difficult.",
19,ARDANANS,ARDANANS,ARDANANS,ARDANA,Neutral,Intolerant,Callous,Materialistic,ardanans,ARDANANS,FALSE,FALSE,,ARDANANS,The Ardanans live in anti-gravity levitated cities due to the unstable nature of their planet's crust. Various social issues would first need to be addressed if they are to be serious candidates for membership.,
20,ARGRATHI,ARGRATHI,ARGRATHI,ARGRATHI,Peaceful,Intolerant,Ruthless,Transactional,argrathi,ARGRATHI,FALSE,FALSE,,ARGRATHI,"The Argrathi are a humanoid race who are prone to suspicion. They are ruled by the Argrathi Authority, who do not take well to any meddling, and should be approached with caution.",
21,ARKARIANS,ARKARIANS,ARKARIANS,ARKARI,Neutral,Intolerant,Honorable,Materialistic,arkarians,ARKARIANS,FALSE,FALSE,x,,,
22,ATREANS,ATREANS,ATREANS,ATREA,Pacifist,Compassion,Ethical,Egalitarian,atreans,ATREANS,TRUE,FALSE,,ATREANS,"The Atreans are a generally amiable people, and outwardly friendly to most species, for they see such contact as a chance to improve their knowledge.",
23,AXANAR,AXANAR,AXANAR,AXANAR,Neutral,Indifferent,Regulated,Transactional,axanar,AXANAR,TRUE,FALSE,,AXANAR,"The Axanar are an androgynous species with a long life span. They could be useful allies, for they value peace and friendship, but when necessary they are capable of defending themselves.",
24,BAJORANS,BAJORANS,BAJORANS,BAJOR,Aggressive,Intolerant,Honorable,Idealistic,bajorans,BAJORANS,TRUE,FALSE,,BAJORANS,We Bajorans are an ancient spiritual race. We have suffered much in recent times. We follow the advice of the Prophets and trust in them.,
25,BAKU,BAKU,BAKU,BAKU,Pacifist,Sympathetic,Ethical,Idealistic,baku,BAKU,FALSE,FALSE,,BAKU,"The Ba'ku are isolationists, who long ago fled from a devastating war. These survivors have now reformed their ways, and enjoy a Peaceful and harmonious lifestyle, almost totally free from the trappings of technology.",
26,BANDI,BANDI,BANDI,BANDI,Peaceful,Intolerant,Ruthless,Greedy,bandi,BANDI,FALSE,FALSE,,BANDI,"Despite their lack of warp technology the Bandi have access to a wealth of trade links, and if they are willing to trade, they would be a lucrative ally indeed.",
27,BANEANS,BANEANS,BANEANS,BANEA,Peaceful,Intolerant,Ethical,Egalitarian,baneans,BANEANS,FALSE,FALSE,,BANEANS,"The Baneans are strict when it comes to security and law, due mainly to their many troubles with the Numiri.",
28,BARZANS,BARZANS,BARZANS,BARZA,Peaceful,Sympathetic,Regulated,Greedy,barzans,BARZANS,TRUE,FALSE,,BARZANS,"The Barzans are undergoing an economic crisis, and they have appealed for assistance. In exchange, they are offering operational rights and access to a wormhole they have discovered.",
29,BENZITES,BENZITES,BENZITES,BENZAR,Neutral,Sympathetic,Ethical,Materialistic,benzites,BENZITES,TRUE,FALSE,,BENZITES,"The Benzite culture values industry and efficiency, and their membership would be a boon for our industrial centers.",
30,BETAZOIDS,BETAZOIDS,BETAZOIDS,BETAZED,Neutral,Compassion,Honorable,Egalitarian,betazoids,BETAZOIDS,TRUE,FALSE,,BETAZOIDS,Betazoid telepathy is an asset that our rivals may try to exploit. We should offer Betazed our protection.,
31,BILANAIANS,BILANAIANS,BILANAIANS,BILANA,Peaceful,Sympathetic,Ethical,Egalitarian,bilanaians,BILANAIANS,TRUE,FALSE,,BILANAIANS,"The Bilanaians are innovators in propulsion, and would be of significant benefit to our own researchers.",
32,BOLIANS,BOLIANS,BOLIANS,BOLIA,Peaceful,Compassion,Ethical,Egalitarian,bolians,BOLIANS,TRUE,FALSE,,BOLIANS,The Bolians are productive trade merchants. With their resources and connections the economical benefits will be immense.,
33,BOMAR,BOMAR,BOMAR,BOMAR,Aggressive,Xenophobia,Callous,Transactional,bomar,BOMAR,TRUE,FALSE,,BOMAR,The B'Omar are slightly xenophobic but they maintain a wide network of colonies due to their ever-growing population levels.,
34,BOSLICS,BOSLICS,BOSLICS,BOSLIC,Aggressive,Intolerant,Ruthless,Greedy,boslics,BOSLICS,TRUE,FALSE,,BOSLICS,"The Boslics are a trading race, and have been known to deal in arms and other contraband.",
35,BOTHA,BOTHA,BOTHA,BOTHA,Warlike,Xenophobia,Callous,Materialistic,botha,BOTHA,TRUE,FALSE,,BOTHA,"The Botha are an elusive race that are not to be entirely trusted. But if they were on our side, their skill for intelligence gathering would be an asset.",
36,BREELLIANS,BREELLIANS,BREELLIANS,BREEL,Peaceful,Sympathetic,Ethical,Idealistic,breellians,BREELLIANS,FALSE,FALSE,,BREELLIANS,The Bre'ellians suffer with overpopulation. A necessary first step in helping them deal with the problem is terraforming the rest of their system to give them more breathing room.,
37,BREEN,BREEN,BREEN,BREEN,Warlike,Intolerant,Ruthless,Materialistic,breen,BREEN,TRUE,FALSE,,BREEN,"The Breen have advanced weapons, so we must be extremely cautious. It will take a great diplomatic effort if we are to have any productive dealings with them.",
38,BREKKIANS,BREKKIANS,BREKKIANS,BREKKA,Aggressive,Intolerant,Ruthless,Greedy,brekkians,BREKKIANS,TRUE,FALSE,,BREKKIANS,"The Brekkians are not a very developed race. Their economy relies on supplying the powerful narcotic Felicium to other civilizations, capitalizing on their dependency on the drug to perpetuate the profitable business.",
39,BYNARS,BYNARS,BYNARS,BYNAR,Peaceful,Indifferent,Callous,Transactional,bynars,BYNARS,TRUE,FALSE,,BYNARS,"The Bynars are an advanced race, and their state-of-the-art computer technology is the very apex of technical sophistication.",
40,CAIRN,CAIRN,CAIRN,CAIRN,Peaceful,Sympathetic,Ethical,Egalitarian,cairn,CAIRN,TRUE,FALSE,,CAIRN,"The Cairn are greatly skilled diplomats and mediators, due to their gift for telepathy. However, this gift comes at the expense of speech and developed language. Communications with the Cairn will be difficult.",
41,CALDONIANS,CALDONIANS,CALDONIANS,CALDON,Pacifist,Compassion,Honorable,Idealistic,caldonians,CALDONIANS,TRUE,FALSE,,CALDONIANS,"The Caldonians are disciplined researchers, and share our love of knowledge for its own sake.",
42,CAPELLANS,CAPELLANS,CAPELLANS,CAPELLA,Warlike,Intolerant,Honorable,Materialistic,capellans,CAPELLANS,FALSE,FALSE,,CAPELLANS,The Capellans are a fiercely tribal people with a troubled history. Their social divisions have hindered any endeavor for technological or political advancement.,
43,CHALNOTH,CHALNOTH,CHALNOTH,CHALNOTH,Warlike,Intolerant,Callous,Materialistic,chalnoth,CHALNOTH,FALSE,FALSE,,CHALNOTH,"The Chalnoth are a brutal race, and should be approached with caution and respect.",
44,CORIDAN,CORIDAN,CORIDAN,CORIDAN,Neutral,Indifferent,Regulated,Transactional,coridan,CORIDAN,TRUE,FALSE,,CORIDAN,"The Coridan inhabit a strategically important system, in both position and resources. They would be a great asset to us.",
45,CORVALLENS,CORVALLENS,CORVALLENS,CORVALLE,Neutral,Indifferent,Callous,Greedy,corvallens,CORVALLENS,TRUE,FALSE,,CORVALLENS,"The Corvallens are a neutral race of traders, raiders, smugglers and mercenaries, and cannot be trusted. We must be cautious in any dealings we have with them.",
46,CYTHERIANS,CYTHERIANS,CYTHERIANS,CYTHERIA,Peaceful,Compassion,Ethical,Idealistic,cytherians,CYTHERIANS,FALSE,FALSE,,CYTHERIANS,"The Cytherians have reached the peak of corporeal development, but they invest little interest in younger races, thus negotiations will be difficult.",
47,DELTANS,DELTANS,DELTANS,DELTA,Peaceful,Compassion,Honorable,Idealistic,deltans,DELTANS,TRUE,FALSE,,DELTANS,"The Deltans are a passionate people, and highly sexual, which engenders deep feelings among all who encounter them. But they have much to offer in both diplomatic and scientific fields.",
48,DENOBULANS,DENOBULANS,DENOBULANS,DENOBULA,Peaceful,Compassion,Honorable,Egalitarian,denobulans,DENOBULANS,TRUE,FALSE,,DENOBULANS,"The amicable Denobulans are a highly sociable race, and they have an interest or point of view in just about anything. They would be an interesting addition to both our scientific and diplomatic circles.",
49,DEVORE,DEVORE,DEVORE,DEVORE,Aggressive,Xenophobia,Regulated,Materialistic,devore,DEVORE,TRUE,FALSE,,DEVORE,"The Devore are a strong and ruthless militaristic people, who have a general dislike and mistrust of any other power.",
50,DOPTERIANS,DOPTERIANS,DOPTERIANS,DOPTERIA,Neutral,Intolerant,Ruthless,Greedy,dopterians,DOPTERIANS,FALSE,FALSE,,DOPTERIANS,The Dopterians are thieves and hoarders - they cannot be trusted. But they do have their uses.,
51,DOSI,DOSI,DOSI,DOSI,Peaceful,Indifferent,Ruthless,Greedy,dosi,DOSI,FALSE,FALSE,,DOSI,"The Dosi are brokers and intermediary traders, of some sway and influence across many sectors. If we want to open any negotiations with them, we must first recognize and understand the treaties they maintain with existing clients.",
52,DRAI,DRAI,DRAI,DRAI,Peaceful,Sympathetic,Ethical,Egalitarian,drai,DRAI,TRUE,FALSE,,DRAI,"The Drai are a technologically advanced race, and would be difficult to sweep aside if opposed. But they are fair and open in diplomatic talks.",
53,DREMANS,DREMANS,DREMANS,DREMA,Peaceful,Sympathetic,Ethical,Egalitarian,dremans,DREMANS,FALSE,FALSE,,DREMANS,"The Dremans are a primitive, pre-warp civilization, living in harsh conditions on the fourth planet in their system. They would be best left alone until they are ready for full contact and disclosure.",
54,EDO,EDO,EDO,EDO,Peaceful,Intolerant,Ethical,Egalitarian,edo,EDO,FALSE,FALSE,,EDO,"The Edo enjoy an idyllic existence, but their legal system is a high price to pay for their bliss.",
55,ELAURIANS,ELAURIANS,ELAURIANS,ELAURIA,Neutral,Indifferent,Regulated,Transactional,elaurians,ELAURIANS,TRUE,FALSE,,ELAURIANS,"The El-Aurians were invaded long ago, and were dispersed as a people. Now they exist as exiles in space, though lending a friendly ear to any who will take them in.",
56,ELAYSIANS,ELAYSIANS,ELAYSIANS,ELAYSIA,Peaceful,Sympathetic,Ethical,Egalitarian,elaysians,ELAYSIANS,FALSE,FALSE,,ELAYSIANS,The Elaysians come from a small planet with naturally low gravity. This can be a problem for them when adapting to the conditions of most other races.,
57,ENTHARANS,ENTHARANS,ENTHARANS,ENTHARA,Peaceful,Xenophobia,Callous,Greedy,entharans,ENTHARANS,TRUE,FALSE,,ENTHARANS,"The Entharans survive on trade relations with their various partners and affiliates. If we were to gain control of it, it could be a lucrative market indeed...",
58,EVORA,EVORA,EVORA,EVORA,Peaceful,Compassion,Ethical,Egalitarian,evora,EVORA,TRUE,FALSE,,EVORA,"The Evora are relatively new to warp science. If they are to continue to grow and develop in space, they must be protected from any that would seek to exploit them.",
59,EXCALBIANS,EXCALBIANS,EXCALBIANS,EXCALBIA,Neutral,Sympathetic,Honorable,Idealistic,excalbians,EXCALBIANS,FALSE,FALSE,,EXCALBIANS,The Excalbians are a rare example of silicon-based life. It would be a worthy study alone just to understand how they function.,
60,FERENGI,FERENGI,FERENGI,FERENGI,Neutral,Intolerant,Ruthless,Greedy,ferengi,FERENGI,TRUE,FALSE,,FERENGI,"The Ferengi are a race of hucksters, living for material wealth and possessions, and the constant desire to acquire more by any means necessary. Their traders can be found across most of the known galaxy, and their trading fleet is an unparalleled economic force. But the Ferengi cannot be trusted, and it will be difficult to maintain political links without a financial incentive to keep their interest. The potential boon to our economy that Ferengi membership would bring cannot be overstated, however.",
61,FLAXIANS,FLAXIANS,FLAXIANS,FLAXIA,Aggressive,Intolerant,Ruthless,Materialistic,flaxians,FLAXIANS,TRUE,FALSE,,FLAXIANS,The Flaxians are a race that specializes in political intrigue and sabotage. They are to be approached with extreme caution.,
62,GORN,GORN,GORN,GORN,Warlike,Xenophobia,Ruthless,Greedy,gorn,GORN,TRUE,FALSE,,GORN,The Gorn will be meticulous in any border agreements we make with them. But perhaps they should not be provoked; the Gorn lay claim to a large area of space and trade relations with the species would be particularly lucrative.,
63,GRAZERITES,GRAZERITES,GRAZERITES,GRAZERITES,Pacifist,Sympathetic,Ethical,Egalitarian,grazerites,GRAZERITES,TRUE,FALSE,,GRAZERITES,"The Grazerites are a race of insightful humanoids, who have dedicated themselves to diplomacy and inter-species understanding.",
64,HAAKONIANS,HAAKONIANS,HAAKONIANS,HAAKONIA,Warlike,Intolerant,Ruthless,Materialistic,haakonians,HAAKONIANS,TRUE,FALSE,,HAAKONIANS,"The Haakonians are a people that now appreciate peace, after enduring a long war with the Talaxians. They seek above all else to absolve themselves of past misdeeds, but their weapons technology remains.",
65,HALKANS,HALKANS,HALKANS,HALKA,Pacifist,Compassion,Honorable,Idealistic,halkans,HALKANS,FALSE,FALSE,,HALKANS,"The Halkans live in total peace, having renounced technology, economics, and strife of any kind.",
66,HAZARI,HAZARI,HAZARI,HAZARI,Warlike,Intolerant,Ruthless,Greedy,hazari,HAZARI,TRUE,FALSE,,HAZARI,The Hazari are a people who seek to profit from tasks and missions performed for other races. They make particularly efficient bounty hunters - for the right price.,
67,HEKARANS,HEKARANS,HEKARANS,HEKARA,Peaceful,Sympathetic,Ethical,Egalitarian,hekarans,HEKARANS,TRUE,FALSE,,HEKARANS,The Hekarans have some radical ideas about improving and refining warp science. Their research could be of great benefit to our own propulsion programs.,
68,HIROGEN,HIROGEN,HIROGEN,HIROGEN,Warlike,Xenophobia,Ruthless,Materialistic,hirogen,HIROGEN,TRUE,FALSE,,HIROGEN,The Hirogen are a militant race of hunters. They long ago abandoned organized social structures in favor of the Hunt.,
